
> ent-esiex-backend@1.0.0 dev
> nodemon src/index.ts

[33m[nodemon] 3.1.10[39m
[33m[nodemon] to restart at any time, enter `rs`[39m
[33m[nodemon] watching path(s): src\**\*[39m
[33m[nodemon] watching extensions: ts,json,env[39m
[32m[nodemon] starting `ts-node src/index.ts src/index.ts`[39m
[dotenv@17.2.3] injecting env (21) from .env -- tip: 👥 sync secrets across teammates & machines: https://dotenvx.com/ops
[dotenv@17.2.3] injecting env (0) from .env -- tip: ⚙️  load multiple .env files with { path: ['.env.local', '.env'] }
🗂  Middlewares initialisés
🛣  Routes initialisés
⭕ Gestion d'erreurs initialisés
✅ Base de données connectée
Error: listen EADDRINUSE: address already in use 0.0.0.0:3001
    at Server.setupListenHandle [as _listen2] (node:net:1940:16)
    at listenInCluster (node:net:1997:12)
    at node:net:2206:7
    at processTicksAndRejections (node:internal/process/task_queues:90:21) {
  code: 'EADDRINUSE',
  errno: -4091,
  syscall: 'listen',
  address: '0.0.0.0',
  port: 3001
}
[31m[nodemon] app crashed - waiting for file changes before starting...[39m
[32m[nodemon] restarting due to changes...[39m
[32m[nodemon] starting `ts-node src/index.ts src/index.ts`[39m
[dotenv@17.2.3] injecting env (21) from .env -- tip: ⚙️  specify custom .env file path with { path: '/custom/path/.env' }
[dotenv@17.2.3] injecting env (0) from .env -- tip: ⚙️  load multiple .env files with { path: ['.env.local', '.env'] }
🗂  Middlewares initialisés
🛣  Routes initialisés
⭕ Gestion d'erreurs initialisés
✅ Base de données connectée
Error: listen EADDRINUSE: address already in use 0.0.0.0:3001
    at Server.setupListenHandle [as _listen2] (node:net:1940:16)
    at listenInCluster (node:net:1997:12)
    at node:net:2206:7
    at processTicksAndRejections (node:internal/process/task_queues:90:21) {
  code: 'EADDRINUSE',
  errno: -4091,
  syscall: 'listen',
  address: '0.0.0.0',
  port: 3001
}
[31m[nodemon] app crashed - waiting for file changes before starting...[39m
[32m[nodemon] restarting due to changes...[39m
[32m[nodemon] starting `ts-node src/index.ts src/index.ts`[39m
[dotenv@17.2.3] injecting env (21) from .env -- tip: ⚙️  load multiple .env files with { path: ['.env.local', '.env'] }
[dotenv@17.2.3] injecting env (0) from .env -- tip: ⚙️  write to custom object with { processEnv: myObject }
🗂  Middlewares initialisés
🛣  Routes initialisés
⭕ Gestion d'erreurs initialisés
✅ Base de données connectée
Error: listen EADDRINUSE: address already in use 0.0.0.0:3001
    at Server.setupListenHandle [as _listen2] (node:net:1940:16)
    at listenInCluster (node:net:1997:12)
    at node:net:2206:7
    at processTicksAndRejections (node:internal/process/task_queues:90:21) {
  code: 'EADDRINUSE',
  errno: -4091,
  syscall: 'listen',
  address: '0.0.0.0',
  port: 3001
}
[31m[nodemon] app crashed - waiting for file changes before starting...[39m
[32m[nodemon] restarting due to changes...[39m
[32m[nodemon] starting `ts-node src/index.ts src/index.ts`[39m
[dotenv@17.2.3] injecting env (21) from .env -- tip: ⚙️  load multiple .env files with { path: ['.env.local', '.env'] }
[dotenv@17.2.3] injecting env (0) from .env -- tip: ⚙️  load multiple .env files with { path: ['.env.local', '.env'] }
🗂  Middlewares initialisés
🛣  Routes initialisés
⭕ Gestion d'erreurs initialisés
✅ Base de données connectée
Error: listen EADDRINUSE: address already in use 0.0.0.0:3001
    at Server.setupListenHandle [as _listen2] (node:net:1940:16)
    at listenInCluster (node:net:1997:12)
    at node:net:2206:7
    at processTicksAndRejections (node:internal/process/task_queues:90:21) {
  code: 'EADDRINUSE',
  errno: -4091,
  syscall: 'listen',
  address: '0.0.0.0',
  port: 3001
}
[31m[nodemon] app crashed - waiting for file changes before starting...[39m
[32m[nodemon] restarting due to changes...[39m
[32m[nodemon] starting `ts-node src/index.ts src/index.ts`[39m
[dotenv@17.2.3] injecting env (21) from .env -- tip: ⚙️  enable debug logging with { debug: true }
[dotenv@17.2.3] injecting env (0) from .env -- tip: ⚙️  load multiple .env files with { path: ['.env.local', '.env'] }
🗂  Middlewares initialisés
🛣  Routes initialisés
⭕ Gestion d'erreurs initialisés
✅ Base de données connectée
Error: listen EADDRINUSE: address already in use 0.0.0.0:3001
    at Server.setupListenHandle [as _listen2] (node:net:1940:16)
    at listenInCluster (node:net:1997:12)
    at node:net:2206:7
    at processTicksAndRejections (node:internal/process/task_queues:90:21) {
  code: 'EADDRINUSE',
  errno: -4091,
  syscall: 'listen',
  address: '0.0.0.0',
  port: 3001
}
[31m[nodemon] app crashed - waiting for file changes before starting...[39m
[32m[nodemon] restarting due to changes...[39m
[32m[nodemon] starting `ts-node src/index.ts src/index.ts`[39m
[dotenv@17.2.3] injecting env (21) from .env -- tip: ⚙️  override existing env vars with { override: true }
[dotenv@17.2.3] injecting env (0) from .env -- tip: ✅ audit secrets and track compliance: https://dotenvx.com/ops
🗂  Middlewares initialisés
🛣  Routes initialisés
⭕ Gestion d'erreurs initialisés
✅ Base de données connectée
Error: listen EADDRINUSE: address already in use 0.0.0.0:3001
    at Server.setupListenHandle [as _listen2] (node:net:1940:16)
    at listenInCluster (node:net:1997:12)
    at node:net:2206:7
    at processTicksAndRejections (node:internal/process/task_queues:90:21) {
  code: 'EADDRINUSE',
  errno: -4091,
  syscall: 'listen',
  address: '0.0.0.0',
  port: 3001
}
[31m[nodemon] app crashed - waiting for file changes before starting...[39m
[32m[nodemon] restarting due to changes...[39m
[32m[nodemon] starting `ts-node src/index.ts src/index.ts`[39m
[dotenv@17.2.3] injecting env (21) from .env -- tip: 🗂️ backup and recover secrets: https://dotenvx.com/ops
[dotenv@17.2.3] injecting env (0) from .env -- tip: ⚙️  load multiple .env files with { path: ['.env.local', '.env'] }
[32m[nodemon] restarting due to changes...[39m
[32m[nodemon] starting `ts-node src/index.ts src/index.ts`[39m
[dotenv@17.2.3] injecting env (21) from .env -- tip: 📡 add observability to secrets: https://dotenvx.com/ops
[dotenv@17.2.3] injecting env (0) from .env -- tip: 🗂️ backup and recover secrets: https://dotenvx.com/ops
🗂  Middlewares initialisés
🛣  Routes initialisés
⭕ Gestion d'erreurs initialisés
✅ Base de données connectée
Error: listen EADDRINUSE: address already in use 0.0.0.0:3001
    at Server.setupListenHandle [as _listen2] (node:net:1940:16)
    at listenInCluster (node:net:1997:12)
    at node:net:2206:7
    at processTicksAndRejections (node:internal/process/task_queues:90:21) {
  code: 'EADDRINUSE',
  errno: -4091,
  syscall: 'listen',
  address: '0.0.0.0',
  port: 3001
}
[31m[nodemon] app crashed - waiting for file changes before starting...[39m
[32m[nodemon] restarting due to changes...[39m
[32m[nodemon] starting `ts-node src/index.ts src/index.ts`[39m
[dotenv@17.2.3] injecting env (21) from .env -- tip: 🔐 prevent building .env in docker: https://dotenvx.com/prebuild
[dotenv@17.2.3] injecting env (0) from .env -- tip: 👥 sync secrets across teammates & machines: https://dotenvx.com/ops
🗂  Middlewares initialisés
🛣  Routes initialisés
⭕ Gestion d'erreurs initialisés
✅ Base de données connectée
🚀 Serveur lancé sur http://0.0.0.0:3001
📝 Environment: development
🌐 CORS origins autorisées: https://www.africbourse.com,https://africbourse.com,http://localhost:5173,http://localhost:5174,http://localhost:5175,http://localhost:5176,http://localhost:5177,http://localhost:5178,http://localhost:5179,http://localhost:5180
📦 Base de données: mongodb+srv://***:***@afribourse.ubtom7d.mongodb.net/afribourse?retryWrites=true&w=majority&appName=Afribourse
[32m[nodemon] restarting due to changes...[39m
[32m[nodemon] starting `ts-node src/index.ts src/index.ts`[39m
[dotenv@17.2.3] injecting env (21) from .env -- tip: ⚙️  specify custom .env file path with { path: '/custom/path/.env' }
[dotenv@17.2.3] injecting env (0) from .env -- tip: 👥 sync secrets across teammates & machines: https://dotenvx.com/ops
🗂  Middlewares initialisés
🛣  Routes initialisés
⭕ Gestion d'erreurs initialisés
✅ Base de données connectée
Error: listen EADDRINUSE: address already in use 0.0.0.0:3001
    at Server.setupListenHandle [as _listen2] (node:net:1940:16)
    at listenInCluster (node:net:1997:12)
    at node:net:2206:7
    at processTicksAndRejections (node:internal/process/task_queues:90:21) {
  code: 'EADDRINUSE',
  errno: -4091,
  syscall: 'listen',
  address: '0.0.0.0',
  port: 3001
}
[31m[nodemon] app crashed - waiting for file changes before starting...[39m
[32m[nodemon] restarting due to changes...[39m
[32m[nodemon] starting `ts-node src/index.ts src/index.ts`[39m
[dotenv@17.2.3] injecting env (21) from .env -- tip: 🔄 add secrets lifecycle management: https://dotenvx.com/ops
[dotenv@17.2.3] injecting env (0) from .env -- tip: 👥 sync secrets across teammates & machines: https://dotenvx.com/ops
🗂  Middlewares initialisés
🛣  Routes initialisés
⭕ Gestion d'erreurs initialisés
✅ Base de données connectée
🚀 Serveur lancé sur http://0.0.0.0:3001
📝 Environment: development
🌐 CORS origins autorisées: https://www.africbourse.com,https://africbourse.com,http://localhost:5173,http://localhost:5174,http://localhost:5175,http://localhost:5176,http://localhost:5177,http://localhost:5178,http://localhost:5179,http://localhost:5180
📦 Base de données: mongodb+srv://***:***@afribourse.ubtom7d.mongodb.net/afribourse?retryWrites=true&w=majority&appName=Afribourse
[32m[nodemon] restarting due to changes...[39m
[32m[nodemon] starting `ts-node src/index.ts src/index.ts`[39m
[dotenv@17.2.3] injecting env (21) from .env -- tip: 🔄 add secrets lifecycle management: https://dotenvx.com/ops
[dotenv@17.2.3] injecting env (0) from .env -- tip: 🔐 prevent committing .env to code: https://dotenvx.com/precommit
🗂  Middlewares initialisés
🛣  Routes initialisés
⭕ Gestion d'erreurs initialisés
✅ Base de données connectée
Error: listen EADDRINUSE: address already in use 0.0.0.0:3001
    at Server.setupListenHandle [as _listen2] (node:net:1940:16)
    at listenInCluster (node:net:1997:12)
    at node:net:2206:7
    at processTicksAndRejections (node:internal/process/task_queues:90:21) {
  code: 'EADDRINUSE',
  errno: -4091,
  syscall: 'listen',
  address: '0.0.0.0',
  port: 3001
}
[31m[nodemon] app crashed - waiting for file changes before starting...[39m
[32m[nodemon] restarting due to changes...[39m
[32m[nodemon] starting `ts-node src/index.ts src/index.ts`[39m
[dotenv@17.2.3] injecting env (21) from .env -- tip: 🔐 prevent committing .env to code: https://dotenvx.com/precommit
[dotenv@17.2.3] injecting env (0) from .env -- tip: ⚙️  write to custom object with { processEnv: myObject }
🗂  Middlewares initialisés
🛣  Routes initialisés
⭕ Gestion d'erreurs initialisés
✅ Base de données connectée
🚀 Serveur lancé sur http://0.0.0.0:3001
📝 Environment: development
🌐 CORS origins autorisées: https://www.africbourse.com,https://africbourse.com,http://localhost:5173,http://localhost:5174,http://localhost:5175,http://localhost:5176,http://localhost:5177,http://localhost:5178,http://localhost:5179,http://localhost:5180
📦 Base de données: mongodb+srv://***:***@afribourse.ubtom7d.mongodb.net/afribourse?retryWrites=true&w=majority&appName=Afribourse
[36m[2025-12-13T14:40:44.651Z][0m [32mGET[0m [33m/api/learning-modules[0m [35mIP:[0m 127.0.0.1
[36m[2025-12-13T14:40:44.672Z][0m [32mGET[0m [33m/api/learning-modules/progress[0m [35mIP:[0m 127.0.0.1
🔒 [AUTH] Cookies received: {
  token: 'eyJhbGciOiJIUzI1NiIsInR5cCI6IkpXVCJ9.eyJpZCI6IjY5M2Q2Yjg5ODBjMTU0NmY5OWQyYjZiNyIsImVtYWlsIjoiZXNzaW9tbGUua3NAZ21haWwuY29tIiwicm9sZSI6InVzZXIiLCJpYXQiOjE3NjU2MzU2ODksImV4cCI6MTc2NjI0MDQ4OX0.pQc406MDwghWSlSu6RdtMLx_GrEoZCl4nGsyiehDPXw'
}
🔒 [AUTH] Headers: token=eyJhbGciOiJIUzI1NiIsInR5cCI6IkpXVCJ9.eyJpZCI6IjY5M2Q2Yjg5ODBjMTU0NmY5OWQyYjZiNyIsImVtYWlsIjoiZXNzaW9tbGUua3NAZ21haWwuY29tIiwicm9sZSI6InVzZXIiLCJpYXQiOjE3NjU2MzU2ODksImV4cCI6MTc2NjI0MDQ4OX0.pQc406MDwghWSlSu6RdtMLx_GrEoZCl4nGsyiehDPXw
✅ [AUTH] User authenticated: essiomle.ks@gmail.com
[36m[2025-12-13T14:40:46.579Z][0m [32mGET[0m [33m/api/learning-modules/progress[0m [35mIP:[0m 127.0.0.1
🔒 [AUTH] Cookies received: {
  token: 'eyJhbGciOiJIUzI1NiIsInR5cCI6IkpXVCJ9.eyJpZCI6IjY5M2Q2Yjg5ODBjMTU0NmY5OWQyYjZiNyIsImVtYWlsIjoiZXNzaW9tbGUua3NAZ21haWwuY29tIiwicm9sZSI6InVzZXIiLCJpYXQiOjE3NjU2MzU2ODksImV4cCI6MTc2NjI0MDQ4OX0.pQc406MDwghWSlSu6RdtMLx_GrEoZCl4nGsyiehDPXw'
}
🔒 [AUTH] Headers: token=eyJhbGciOiJIUzI1NiIsInR5cCI6IkpXVCJ9.eyJpZCI6IjY5M2Q2Yjg5ODBjMTU0NmY5OWQyYjZiNyIsImVtYWlsIjoiZXNzaW9tbGUua3NAZ21haWwuY29tIiwicm9sZSI6InVzZXIiLCJpYXQiOjE3NjU2MzU2ODksImV4cCI6MTc2NjI0MDQ4OX0.pQc406MDwghWSlSu6RdtMLx_GrEoZCl4nGsyiehDPXw
✅ [AUTH] User authenticated: essiomle.ks@gmail.com
[36m[2025-12-13T14:40:47.323Z][0m [32mGET[0m [33m/api/learning-modules[0m [35mIP:[0m 127.0.0.1
[36m[2025-12-13T14:40:52.623Z][0m [32mPOST[0m [33m/api/learning-modules/pret-decollage/complete[0m [35mIP:[0m 127.0.0.1
🔒 [AUTH] Cookies received: {
  token: 'eyJhbGciOiJIUzI1NiIsInR5cCI6IkpXVCJ9.eyJpZCI6IjY5M2Q2Yjg5ODBjMTU0NmY5OWQyYjZiNyIsImVtYWlsIjoiZXNzaW9tbGUua3NAZ21haWwuY29tIiwicm9sZSI6InVzZXIiLCJpYXQiOjE3NjU2MzU2ODksImV4cCI6MTc2NjI0MDQ4OX0.pQc406MDwghWSlSu6RdtMLx_GrEoZCl4nGsyiehDPXw'
}
🔒 [AUTH] Headers: token=eyJhbGciOiJIUzI1NiIsInR5cCI6IkpXVCJ9.eyJpZCI6IjY5M2Q2Yjg5ODBjMTU0NmY5OWQyYjZiNyIsImVtYWlsIjoiZXNzaW9tbGUua3NAZ21haWwuY29tIiwicm9sZSI6InVzZXIiLCJpYXQiOjE3NjU2MzU2ODksImV4cCI6MTc2NjI0MDQ4OX0.pQc406MDwghWSlSu6RdtMLx_GrEoZCl4nGsyiehDPXw
✅ [AUTH] User authenticated: essiomle.ks@gmail.com
[36m[2025-12-13T14:40:53.958Z][0m [32mGET[0m [33m/api/learning-modules[0m [35mIP:[0m 127.0.0.1
[36m[2025-12-13T14:40:53.958Z][0m [32mGET[0m [33m/api/learning-modules/progress[0m [35mIP:[0m 127.0.0.1
🔒 [AUTH] Cookies received: {
  token: 'eyJhbGciOiJIUzI1NiIsInR5cCI6IkpXVCJ9.eyJpZCI6IjY5M2Q2Yjg5ODBjMTU0NmY5OWQyYjZiNyIsImVtYWlsIjoiZXNzaW9tbGUua3NAZ21haWwuY29tIiwicm9sZSI6InVzZXIiLCJpYXQiOjE3NjU2MzU2ODksImV4cCI6MTc2NjI0MDQ4OX0.pQc406MDwghWSlSu6RdtMLx_GrEoZCl4nGsyiehDPXw'
}
🔒 [AUTH] Headers: token=eyJhbGciOiJIUzI1NiIsInR5cCI6IkpXVCJ9.eyJpZCI6IjY5M2Q2Yjg5ODBjMTU0NmY5OWQyYjZiNyIsImVtYWlsIjoiZXNzaW9tbGUua3NAZ21haWwuY29tIiwicm9sZSI6InVzZXIiLCJpYXQiOjE3NjU2MzU2ODksImV4cCI6MTc2NjI0MDQ4OX0.pQc406MDwghWSlSu6RdtMLx_GrEoZCl4nGsyiehDPXw
✅ [AUTH] User authenticated: essiomle.ks@gmail.com
[36m[2025-12-13T14:40:58.360Z][0m [32mGET[0m [33m/api/news/latest[0m [35mIP:[0m 127.0.0.1
[36m[2025-12-13T14:40:58.571Z][0m [32mGET[0m [33m/api/news/latest[0m [35mIP:[0m 127.0.0.1
🔄 Tâche de scraping exécutée toutes les 2 heures
✅ Extraction réussie: 48 actions trouvées.
Scraped Index: cotation_BRVMAG - BRVM - AGRICULTURE
Scraped Index: cotation_BRVMAS - BRVM - AUTRES SECTEURS
Scraped Index: cotation_BRVM-CB - BRVM - CONSOMMATION DE BASE
Scraped Index: cotation_BRVM-CD - BRVM - CONSOMMATION DISCRETIONNAIRE
Scraped Index: cotation_BRVMDI - BRVM - DISTRIBUTION
Scraped Index: cotation_BRVM-EN - BRVM - ENERGIE
Scraped Index: cotation_BRVMFI - BRVM - FINANCE
Scraped Index: cotation_BRVMIN - BRVM - INDUSTRIE
Scraped Index: cotation_BRVM-IN - BRVM - INDUSTRIELS
Scraped Index: cotation_BRVMPR - BRVM - PRESTIGE
Scraped Index: cotation_BRVMPA - BRVM - PRINCIPAL
Scraped Index: cotation_BRVM-SF - BRVM - SERVICES FINANCIERS
Scraped Index: cotation_BRVMSP - BRVM - SERVICES PUBLICS
Scraped Index: cotation_BRVM-SP - BRVM - SERVICES PUBLICS
Scraped Index: cotation_BRVM-TEL - BRVM - TELECOMMUNICATIONS
Scraped Index: cotation_BRVMTR - BRVM - TRANSPORT
Scraped Index: cotation_BRVM30 - BRVM 30
Scraped Index: cotation_BRVMC - BRVM COMPOSITE
Scraped Index: cotation_CAPIBRVM - Capitalisation BRVM
Scraped Index: cotation_SIKAIDX - INDICE SIKAFINANCE
Scraped Index: cotation_SIKATR - SIKA TOTAL RETURN
✅ Extraction réussie: 21 indices trouvés.
✅ 48 actions traitées par Prisma.
✅ 21 indices traités par Prisma.
✅ Scraping et sauvegarde terminés avec succès
[2025-12-13T17:04:18.395Z] [PID: 81384] [32m[NODE-CRON][32m [33m[WARN][0m missed execution at Sat Dec 13 2025 18:00:00 GMT+0100 (heure normale d’Europe centrale)! Possible blocking IO or high CPU user at the same process used by node-cron.
[2025-12-13T23:00:29.013Z] [PID: 81384] [32m[NODE-CRON][32m [33m[WARN][0m missed execution at Sat Dec 13 2025 20:00:00 GMT+0100 (heure normale d’Europe centrale)! Possible blocking IO or high CPU user at the same process used by node-cron.
[2025-12-13T23:00:31.430Z] [PID: 81384] [32m[NODE-CRON][32m [33m[WARN][0m missed execution at Sat Dec 13 2025 22:00:00 GMT+0100 (heure normale d’Europe centrale)! Possible blocking IO or high CPU user at the same process used by node-cron.
[2025-12-13T23:00:31.508Z] [PID: 81384] [32m[NODE-CRON][32m [33m[WARN][0m missed execution at Sun Dec 14 2025 00:00:00 GMT+0100 (heure normale d’Europe centrale)! Possible blocking IO or high CPU user at the same process used by node-cron.
[31m[nodemon] app crashed - waiting for file changes before starting...[39m
[32m[nodemon] restarting due to changes...[39m
[32m[nodemon] starting `ts-node src/index.ts src/index.ts`[39m
[dotenv@17.2.3] injecting env (21) from .env -- tip: 🔑 add access controls to secrets: https://dotenvx.com/ops
[dotenv@17.2.3] injecting env (0) from .env -- tip: 🛠️  run anywhere with `dotenvx run -- yourcommand`
🗂  Middlewares initialisés
🛣  Routes initialisés
⭕ Gestion d'erreurs initialisés
✅ Base de données connectée
🚀 Serveur lancé sur http://0.0.0.0:3001
📝 Environment: development
🌐 CORS origins autorisées: https://www.africbourse.com,https://africbourse.com,http://localhost:5173,http://localhost:5174,http://localhost:5175,http://localhost:5176,http://localhost:5177,http://localhost:5178,http://localhost:5179,http://localhost:5180
📦 Base de données: mongodb+srv://***:***@afribourse.ubtom7d.mongodb.net/afribourse?retryWrites=true&w=majority&appName=Afribourse
[31m[nodemon] app crashed - waiting for file changes before starting...[39m
[32m[nodemon] restarting due to changes...[39m
[32m[nodemon] starting `ts-node src/index.ts src/index.ts`[39m
[dotenv@17.2.3] injecting env (21) from .env -- tip: ⚙️  load multiple .env files with { path: ['.env.local', '.env'] }
[dotenv@17.2.3] injecting env (0) from .env -- tip: 🔄 add secrets lifecycle management: https://dotenvx.com/ops
🗂  Middlewares initialisés
🛣  Routes initialisés
⭕ Gestion d'erreurs initialisés
✅ Base de données connectée
Error: listen EADDRINUSE: address already in use 0.0.0.0:3001
    at Server.setupListenHandle [as _listen2] (node:net:1940:16)
    at listenInCluster (node:net:1997:12)
    at node:net:2206:7
    at processTicksAndRejections (node:internal/process/task_queues:90:21) {
  code: 'EADDRINUSE',
  errno: -4091,
  syscall: 'listen',
  address: '0.0.0.0',
  port: 3001
}
[31m[nodemon] app crashed - waiting for file changes before starting...[39m
